date,text,ticker,neg,neu,pos,compound,Returns_1,Returns_2,Returns_3,Returns_4,Returns_5
2023-03-24,"What a rollercoaster of a day… 3-23-23 SPY/ES Futures, VIX, DXY and 10YR YIELD Daily Market Analysis.",ES,0.0,1.0,0.0,0.0,0.03385670111854733,0.030059940353324377,0.010811601812398708,-0.005907022137562445,-0.00237123299291353
2023-03-24,Can somebody tell me why options are addicting?,S&P,0.0,1.0,0.0,0.0,0.005639807253104534,0.008641168153277645,-0.007964317107427066,0.004914482481405802,0.01387671553855152
2023-03-24,0DTE.,S&P,0.0,1.0,0.0,0.0,0.005639807253104534,0.008641168153277645,-0.007964317107427066,0.004914482481405802,0.01387671553855152
2023-03-24,Bought puts all along the ride up this morning till all-in.,S&P,0.0,1.0,0.0,0.0,0.005639807253104534,0.008641168153277645,-0.007964317107427066,0.004914482481405802,0.01387671553855152
2023-03-24,Down 10k at 11 am.,S&P,0.0,1.0,0.0,0.0,0.005639807253104534,0.008641168153277645,-0.007964317107427066,0.004914482481405802,0.01387671553855152
2023-03-24,Up 18k by 3 pm.,S&P,0.0,1.0,0.0,0.0,0.005639807253104534,0.008641168153277645,-0.007964317107427066,0.004914482481405802,0.01387671553855152
2023-03-24,~$17K SPY Put Yolo 85 DTE.,DTE,0.0,0.704,0.296,0.2732,0.005639807253104534,0.008641168153277645,-0.007964317107427066,0.004914482481405802,0.01387671553855152
2023-03-24,I don't think people really understand the impact of the rate hikes at a large scale...,S&P,0.0,1.0,0.0,0.0,0.005639807253104534,0.008641168153277645,-0.007964317107427066,0.004914482481405802,0.01387671553855152
2023-03-24,Fraport - what’s going on?,S&P,0.0,1.0,0.0,0.0,0.005639807253104534,0.008641168153277645,-0.007964317107427066,0.004914482481405802,0.01387671553855152
2023-03-24,Banks continue to rely on Fed liquidity as financial turmoil persists.,S&P,0.2,0.8,0.0,-0.3612,0.005639807253104534,0.008641168153277645,-0.007964317107427066,0.004914482481405802,0.01387671553855152
2023-03-24,NVDIA Short Trade Setup.,S&P,0.0,1.0,0.0,0.0,0.005639807253104534,0.008641168153277645,-0.007964317107427066,0.004914482481405802,0.01387671553855152
2023-03-24,Regulation CF with Cytonics Corp?,CF,0.0,1.0,0.0,0.0,0.005639807253104534,0.008641168153277645,-0.007964317107427066,0.004914482481405802,0.01387671553855152
2023-03-24,They're beginning human trials soon and awaiting FDA approval.,S&P,0.0,0.721,0.279,0.4767,0.005639807253104534,0.008641168153277645,-0.007964317107427066,0.004914482481405802,0.01387671553855152
2023-03-24,Any ideas on how/where to open a short position against the $USD?,S&P,0.0,1.0,0.0,0.0,0.005639807253104534,0.008641168153277645,-0.007964317107427066,0.004914482481405802,0.01387671553855152
2023-03-24,How to successfully gamble your retirement funds.,S&P,0.0,0.652,0.348,0.4939,0.005639807253104534,0.008641168153277645,-0.007964317107427066,0.004914482481405802,0.01387671553855152
2023-03-24,$85k Gains (+92%) in 10 months.,S&P,0.0,0.676,0.324,0.34,0.005639807253104534,0.008641168153277645,-0.007964317107427066,0.004914482481405802,0.01387671553855152
2023-03-24,"Sent to my friend from her bank, literally speechless.",S&P,0.0,0.714,0.286,0.4939,0.005639807253104534,0.008641168153277645,-0.007964317107427066,0.004914482481405802,0.01387671553855152
2023-03-24,"First Republic Bank (FRC), Firm Investigating Rating Agencies' Cut to Junk and Possible Securities Law Violations.",S&P,0.266,0.628,0.106,-0.5106,0.005639807253104534,0.008641168153277645,-0.007964317107427066,0.004914482481405802,0.01387671553855152
2023-03-24,Real Life 'Ted Lasso'?,S&P,0.0,1.0,0.0,0.0,0.005639807253104534,0.008641168153277645,-0.007964317107427066,0.004914482481405802,0.01387671553855152
2023-03-24,Apple May Get Into English Football - Just Not AFC Richmond.,S&P,0.0,1.0,0.0,0.0,0.005639807253104534,0.008641168153277645,-0.007964317107427066,0.004914482481405802,0.01387671553855152
2023-03-24,Central banks hike rates as turmoil hits bank shares again.,S&P,0.197,0.63,0.173,-0.0772,0.005639807253104534,0.008641168153277645,-0.007964317107427066,0.004914482481405802,0.01387671553855152
2023-03-24,Banking Crisis Strikes!,S&P,0.873,0.127,0.0,-0.784,0.005639807253104534,0.008641168153277645,-0.007964317107427066,0.004914482481405802,0.01387671553855152
2023-03-24,"A large group of macro hedge funds hit hard, with the biggest drop of 32%.",S&P,0.212,0.788,0.0,-0.3612,0.005639807253104534,0.008641168153277645,-0.007964317107427066,0.004914482481405802,0.01387671553855152
2023-03-24,Printer go Brrrr for the second week.,S&P,0.0,1.0,0.0,0.0,0.005639807253104534,0.008641168153277645,-0.007964317107427066,0.004914482481405802,0.01387671553855152
2023-03-24,Capitulation Liquidity Pull.,S&P,0.0,1.0,0.0,0.0,0.005639807253104534,0.008641168153277645,-0.007964317107427066,0.004914482481405802,0.01387671553855152
2023-03-24,When you try to trade FOMC.,S&P,0.0,1.0,0.0,0.0,0.005639807253104534,0.008641168153277645,-0.007964317107427066,0.004914482481405802,0.01387671553855152
2023-03-24,"0DTE Jackpot: $280,000+ in 4 Hours.",S&P,0.0,1.0,0.0,0.0,0.005639807253104534,0.008641168153277645,-0.007964317107427066,0.004914482481405802,0.01387671553855152
2023-03-24,Full Regard Edition.,S&P,0.0,1.0,0.0,0.0,0.005639807253104534,0.008641168153277645,-0.007964317107427066,0.004914482481405802,0.01387671553855152
2023-03-24,"Banning TikTok would boost Alphabet, Meta, and Snap—Here’s how much their stocks could jump.",S&P,0.0,0.828,0.172,0.4019,0.005639807253104534,0.008641168153277645,-0.007964317107427066,0.004914482481405802,0.01387671553855152
2023-03-24,NVDA is up 74% since ChatGPT release (152% since Oct bottom).,NVDA,0.0,1.0,0.0,0.0,-0.01515205421536181,0.011750098062569547,0.022138320266962053,0.03393825693020025,0.04097185051475938
2023-03-24,Overvalued by ANY metric.,S&P,0.0,1.0,0.0,0.0,0.005639807253104534,0.008641168153277645,-0.007964317107427066,0.004914482481405802,0.01387671553855152
2023-03-24,What will trigger a repricing?,S&P,0.0,1.0,0.0,0.0,0.005639807253104534,0.008641168153277645,-0.007964317107427066,0.004914482481405802,0.01387671553855152
2023-03-24,"What Are Your Moves Tomorrow, March 24, 2023.",S&P,0.0,1.0,0.0,0.0,0.005639807253104534,0.008641168153277645,-0.007964317107427066,0.004914482481405802,0.01387671553855152
2023-03-24,I got the $2570s this morning for $8.,S&P,0.0,1.0,0.0,0.0,0.005639807253104534,0.008641168153277645,-0.007964317107427066,0.004914482481405802,0.01387671553855152
2023-03-24,Sold the same day for $46.,S&P,0.0,1.0,0.0,0.0,0.005639807253104534,0.008641168153277645,-0.007964317107427066,0.004914482481405802,0.01387671553855152
2023-03-24,BKNG is all I play.,BKNG,0.0,0.625,0.375,0.34,0.005639807253104534,0.008641168153277645,-0.007964317107427066,0.004914482481405802,0.01387671553855152
2023-03-24,A Thank You To All The Regard Bulls! 🤏🏻,S&P,0.0,0.798,0.202,0.4199,0.005639807253104534,0.008641168153277645,-0.007964317107427066,0.004914482481405802,0.01387671553855152
2023-03-24,Two modes of the main fund-raising and three types of stocks to lie down and win the stock market.,S&P,0.0,0.826,0.174,0.5859,0.005639807253104534,0.008641168153277645,-0.007964317107427066,0.004914482481405802,0.01387671553855152
2023-03-24,Love me a good pump.,S&P,0.0,0.297,0.703,0.7964,0.005639807253104534,0.008641168153277645,-0.007964317107427066,0.004914482481405802,0.01387671553855152
2023-03-24,879% <> 20k Gain.,S&P,0.0,0.469,0.531,0.5267,0.005639807253104534,0.008641168153277645,-0.007964317107427066,0.004914482481405802,0.01387671553855152
2023-03-24,🌈 🐻 Proof that the bull market has started?,S&P,0.0,1.0,0.0,0.0,0.005639807253104534,0.008641168153277645,-0.007964317107427066,0.004914482481405802,0.01387671553855152
2023-03-24,Anyone here know about Milton Friedman?,S&P,0.0,1.0,0.0,0.0,0.005639807253104534,0.008641168153277645,-0.007964317107427066,0.004914482481405802,0.01387671553855152
2023-03-24,What happens to covered calls when delisting happens?,S&P,0.0,1.0,0.0,0.0,0.005639807253104534,0.008641168153277645,-0.007964317107427066,0.004914482481405802,0.01387671553855152
2023-03-24,The Hindenburg report on Square.,S&P,0.0,1.0,0.0,0.0,0.005639807253104534,0.008641168153277645,-0.007964317107427066,0.004914482481405802,0.01387671553855152
2023-03-24,S&P 500 rallies as tech reigns supreme after Fed fallout.,S&P,0.0,0.714,0.286,0.5574,0.005639807253104534,0.008641168153277645,-0.007964317107427066,0.004914482481405802,0.01387671553855152
2023-03-24,Knock knock.,S&P,0.0,1.0,0.0,0.0,0.005639807253104534,0.008641168153277645,-0.007964317107427066,0.004914482481405802,0.01387671553855152
2023-03-24,You're next.,S&P,0.0,1.0,0.0,0.0,0.005639807253104534,0.008641168153277645,-0.007964317107427066,0.004914482481405802,0.01387671553855152
2023-03-24,That’s cuz they survived every recession since 1920.,S&P,0.231,0.496,0.273,0.128,0.005639807253104534,0.008641168153277645,-0.007964317107427066,0.004914482481405802,0.01387671553855152
2023-03-24,Retail investors target U.S. small-cap IPOs amid market turmoil.,S&P,0.238,0.762,0.0,-0.3612,0.005639807253104534,0.008641168153277645,-0.007964317107427066,0.004914482481405802,0.01387671553855152
2023-03-24,"Took 1 trade to go green, was down $3k.",S&P,0.0,1.0,0.0,0.0,0.005639807253104534,0.008641168153277645,-0.007964317107427066,0.004914482481405802,0.01387671553855152
2023-03-24,There… I fixed it…,S&P,0.0,1.0,0.0,0.0,0.005639807253104534,0.008641168153277645,-0.007964317107427066,0.004914482481405802,0.01387671553855152
2023-03-24,Bitcoin or Barclays in a crash?,S&P,0.351,0.649,0.0,-0.4019,0.005639807253104534,0.008641168153277645,-0.007964317107427066,0.004914482481405802,0.01387671553855152
2023-03-24,Hawaiian banks as a refuge during the current turbulence in the regional banking sector.,S&P,0.0,1.0,0.0,0.0,0.005639807253104534,0.008641168153277645,-0.007964317107427066,0.004914482481405802,0.01387671553855152
2023-03-24,Don't you love parabolas?,S&P,0.529,0.471,0.0,-0.5216,0.005639807253104534,0.008641168153277645,-0.007964317107427066,0.004914482481405802,0.01387671553855152
2023-03-24,Do you think there is still a banking crisis?,S&P,0.339,0.661,0.0,-0.6249,0.005639807253104534,0.008641168153277645,-0.007964317107427066,0.004914482481405802,0.01387671553855152
2023-03-24,New Account 10x Speedrun.,S&P,0.0,1.0,0.0,0.0,0.005639807253104534,0.008641168153277645,-0.007964317107427066,0.004914482481405802,0.01387671553855152
2023-03-24,How long till I lose it all?,S&P,0.31,0.69,0.0,-0.4019,0.005639807253104534,0.008641168153277645,-0.007964317107427066,0.004914482481405802,0.01387671553855152
2023-03-24,Tomorrow or Monday.,S&P,0.0,1.0,0.0,0.0,0.005639807253104534,0.008641168153277645,-0.007964317107427066,0.004914482481405802,0.01387671553855152
2023-03-24,270K SPX APPL NVDA puts.,NVDA,0.0,1.0,0.0,0.0,-0.01515205421536181,0.011750098062569547,0.022138320266962053,0.03393825693020025,0.04097185051475938
2023-03-24,Money Printer Go Brr (Sad Edition).,S&P,0.383,0.617,0.0,-0.4767,0.005639807253104534,0.008641168153277645,-0.007964317107427066,0.004914482481405802,0.01387671553855152
2023-03-24,YOLO?,S&P,0.0,0.0,1.0,0.2732,0.005639807253104534,0.008641168153277645,-0.007964317107427066,0.004914482481405802,0.01387671553855152
2023-03-24,Got approved for options recently and bet my entire account on a collapse.,S&P,0.188,0.647,0.165,-0.1027,0.005639807253104534,0.008641168153277645,-0.007964317107427066,0.004914482481405802,0.01387671553855152
2023-03-24,"I’m in college, is this regarded enough?",S&P,0.0,1.0,0.0,0.0,0.005639807253104534,0.008641168153277645,-0.007964317107427066,0.004914482481405802,0.01387671553855152
2023-03-24,For all the degens that want to learn a bit - ITM vs. ATM Options Comparison.,S&P,0.0,0.92,0.08,0.0772,0.005639807253104534,0.008641168153277645,-0.007964317107427066,0.004914482481405802,0.01387671553855152
2023-03-24,TA Challenge: Put Volume-Weighted Average Price (VWAP) into your day trading toolbox.,S&P,0.0,0.894,0.106,0.0772,0.005639807253104534,0.008641168153277645,-0.007964317107427066,0.004914482481405802,0.01387671553855152
2023-03-24,AAP - Advanced Auto Parts.,AAP,0.0,0.667,0.333,0.25,0.005639807253104534,0.008641168153277645,-0.007964317107427066,0.004914482481405802,0.01387671553855152
2023-03-24,Block’s statement on short seller report.,S&P,0.0,1.0,0.0,0.0,0.005639807253104534,0.008641168153277645,-0.007964317107427066,0.004914482481405802,0.01387671553855152
2023-03-24,Strongly believe in GOTU.,GOTU,0.0,0.588,0.412,0.2732,0.005639807253104534,0.008641168153277645,-0.007964317107427066,0.004914482481405802,0.01387671553855152
2023-03-24,Off-hours Trading Impact.,S&P,0.0,1.0,0.0,0.0,0.005639807253104534,0.008641168153277645,-0.007964317107427066,0.004914482481405802,0.01387671553855152
2023-03-24,I expect a mini-run to a decent run.,S&P,0.0,1.0,0.0,0.0,0.005639807253104534,0.008641168153277645,-0.007964317107427066,0.004914482481405802,0.01387671553855152
2023-03-24,But then…,S&P,0.0,1.0,0.0,0.0,0.005639807253104534,0.008641168153277645,-0.007964317107427066,0.004914482481405802,0.01387671553855152
2023-03-24,Stop loss on my 100 SPY 400 3/31 hit.,S&P,0.391,0.609,0.0,-0.5423,0.005639807253104534,0.008641168153277645,-0.007964317107427066,0.004914482481405802,0.01387671553855152
2023-03-24,Was at 160k but I’ll take 154k with a 10k gain.,S&P,0.0,0.685,0.315,0.6808,0.005639807253104534,0.008641168153277645,-0.007964317107427066,0.004914482481405802,0.01387671553855152
2023-03-24,"Minus is where I bought, Plus is where I sold.",S&P,0.0,1.0,0.0,0.0,0.005639807253104534,0.008641168153277645,-0.007964317107427066,0.004914482481405802,0.01387671553855152
2023-03-24,Nasdaq leads Wall Street rally as hopes of Fed rate-hike pause grow.,S&P,0.0,0.797,0.203,0.4215,0.005639807253104534,0.008641168153277645,-0.007964317107427066,0.004914482481405802,0.01387671553855152
2023-03-24,I bought $SCHW at $58. I’m in for a roller coaster. Nothing to see here. Bullish.,SCHW,0.0,1.0,0.0,0.0,0.005639807253104534,0.008641168153277645,-0.007964317107427066,0.004914482481405802,0.01387671553855152
2023-03-24,Aren't Tier 1 Msos (Cannabis) Looking Attractive for Long Term Trade?,S&P,0.0,0.775,0.225,0.4404,0.005639807253104534,0.008641168153277645,-0.007964317107427066,0.004914482481405802,0.01387671553855152
2023-03-24,OpenAI helped with homework so I bought AI ticker.,S&P,0.0,1.0,0.0,0.0,0.005639807253104534,0.008641168153277645,-0.007964317107427066,0.004914482481405802,0.01387671553855152
2023-03-24,U.S. regional bank liquidity risk continues to spread as market rate hike expectations cut sharply.,S&P,0.244,0.756,0.0,-0.4939,0.005639807253104534,0.008641168153277645,-0.007964317107427066,0.004914482481405802,0.01387671553855152
2023-03-24,Been trying a new trading strategy. Buy high... for those who trade spy(SPX) calls/puts what is your strategy?,S&P,0.0,1.0,0.0,0.0,0.005639807253104534,0.008641168153277645,-0.007964317107427066,0.004914482481405802,0.01387671553855152
2023-03-24,Meow me.,S&P,0.0,1.0,0.0,0.0,0.005639807253104534,0.008641168153277645,-0.007964317107427066,0.004914482481405802,0.01387671553855152
2023-03-24,A massive gains/losses counter that everyone contributed to would be cool to watch.,S&P,0.0,0.839,0.161,0.3182,0.005639807253104534,0.008641168153277645,-0.007964317107427066,0.004914482481405802,0.01387671553855152
2023-03-24,Is there an ETF/ETN that exposes me to the Norwegian krone (or Nordic currencies in general)?,ETN,0.091,0.909,0.0,-0.128,0.005639807253104534,0.008641168153277645,-0.007964317107427066,0.004914482481405802,0.01387671553855152
2023-03-24,I’m Project POW And I’m Down For My Crown Mang.,S&P,0.0,1.0,0.0,0.0,0.005639807253104534,0.008641168153277645,-0.007964317107427066,0.004914482481405802,0.01387671553855152
2023-03-24,We have come full circle! Time to buy MSFT.,MSFT,0.0,1.0,0.0,0.0,0.010480456759089485,0.030408749933734214,0.024800966378831557,0.030635844694982817,0.004079786273194497
2023-03-24,Jesus Christ... that's Jason Bourne.,S&P,0.0,1.0,0.0,0.0,0.005639807253104534,0.008641168153277645,-0.007964317107427066,0.004914482481405802,0.01387671553855152
2023-03-24,Sounds about right LOL: “Nearly $100 billion in deposits pulled from banks; officials call system 'sound and resilient'”.,S&P,0.0,0.828,0.172,0.5473,0.005639807253104534,0.008641168153277645,-0.007964317107427066,0.004914482481405802,0.01387671553855152
2023-03-24,Silly bers.,S&P,0.0,0.476,0.524,0.0258,0.005639807253104534,0.008641168153277645,-0.007964317107427066,0.004914482481405802,0.01387671553855152
2023-03-24,All in FRC Roth IRA.,S&P,0.0,1.0,0.0,0.0,0.005639807253104534,0.008641168153277645,-0.007964317107427066,0.004914482481405802,0.01387671553855152
2023-03-24,Value hail mary.,S&P,0.0,0.213,0.787,0.4019,0.005639807253104534,0.008641168153277645,-0.007964317107427066,0.004914482481405802,0.01387671553855152
2023-03-24,Did everyone fill out their march madness brackets?,S&P,0.293,0.707,0.0,-0.4404,0.005639807253104534,0.008641168153277645,-0.007964317107427066,0.004914482481405802,0.01387671553855152
2023-03-24,21k SPY Calls 1-3DTE PT.2 - y’all keep being bearish.,S&P,0.0,1.0,0.0,0.0,0.005639807253104534,0.008641168153277645,-0.007964317107427066,0.004914482481405802,0.01387671553855152
2023-03-24,What would happen if Cramer said he was bullish on $SJIM and that was the only ETF or stock he talked about until his retirement?,S&P,0.0,1.0,0.0,0.0,0.005639807253104534,0.008641168153277645,-0.007964317107427066,0.004914482481405802,0.01387671553855152
2023-03-25,"Weekend Discussion Thread for the Weekend of March 25, 2023.",S&P,0.0,1.0,0.0,0.0,,,,,
2023-03-25,Volatility in mortgage rates will lead to further deterioration of the U.S. real estate sector in 2023.,S&P,0.0,1.0,0.0,0.0,,,,,
2023-03-25,"Most Anticipated Earnings Releases for the week beginning March 27th, 2023.",S&P,0.0,1.0,0.0,0.0,,,,,
2023-03-25,"It’s not looking great, boys.",S&P,0.452,0.548,0.0,-0.5096,,,,,
2023-03-25,Good? Bad? Little bit of both?,S&P,0.369,0.366,0.265,-0.2824,,,,,
2023-03-25,"Don’t Get Me Wrong, but how is it possible that the Dow and everything is up?",S&P,0.12,0.88,0.0,-0.2617,,,,,
2023-03-25,"Deutsche Bank is not the next Credit Suisse, analysts say, as panic spreads.",S&P,0.333,0.667,0.0,-0.6688,,,,,
2023-03-25,Cathie Wood Today Buys $21M Of Block Stock; And Sells Over $27M In Tesla.,S&P,0.182,0.818,0.0,-0.4404,,,,,
2023-03-25,Going in big.,S&P,0.0,1.0,0.0,0.0,,,,,
2023-03-25,Deutsche Bank kiss of death.,S&P,0.301,0.361,0.337,0.0772,,,,,
2023-03-25,Who would win? Bank of America Identifies the Next Bubble And Says Investors Should Sell Stocks Rather Than Buy Them After the Last Rate Hike.,S&P,0.0,0.863,0.137,0.5859,,,,,
2023-03-25,Backstopping deposits doesn't mean the banks won't fail - here's who's next.,S&P,0.0,0.794,0.206,0.431,,,,,
2023-03-25,Traders bet on Fed rate cut as early as June amid fears of banking crisis.,S&P,0.429,0.571,0.0,-0.8402,,,,,
2023-03-25,You Know Oils in Trouble When OPEC Has This Front & Center on Their Own Website.,S&P,0.153,0.847,0.0,-0.4019,,,,,
2023-03-25,A Fool's guide for Option Greeks.,S&P,0.0,1.0,0.0,0.0,,,,,
2023-03-25,I read that S&P 500 became 119 fold over the past 50 years.,S&P,0.0,1.0,0.0,0.0,,,,,
2023-03-25,Short Sellers on the prowl.,S&P,0.0,1.0,0.0,0.0,,,,,
2023-03-25,3-24-23 Banks are oversold.,S&P,0.0,1.0,0.0,0.0,,,,,
2023-03-25,"Signature Bank Founders Lost a Small Fortune in Bank Collapse: Prior, their Signature holdings dropped 80 percent. After seizure, all vanished.",S&P,0.224,0.776,0.0,-0.6705,,,,,
2023-03-25,$NVDA short term bearish with head and shoulders pattern. 3/31 $250 puts printing 👀 #NFA.,NVDA,0.0,1.0,0.0,0.0,,,,,
2023-03-25,A very brief post from March 24.,S&P,0.0,1.0,0.0,0.0,,,,,
2023-03-25,The market is being held up by 7 companies.,S&P,0.0,1.0,0.0,0.0,,,,,
2023-03-25,SOFI stock? Potential or nah?,SOFI,0.306,0.694,0.0,-0.1926,,,,,
2023-03-25,Interesting Short-Seller Drama Playing Out on Twitter with SGML.,SGML,0.0,0.609,0.391,0.5423,,,,,
2023-03-25,Deutsche Bank shares drop amid global jitters over banks.,S&P,0.186,0.619,0.195,0.0258,,,,,
2023-03-25,FLNG- Heard they will be getting a nice jump today. 4/21 C.,FLNG,0.0,0.797,0.203,0.4215,,,,,
2023-03-25,The swap contract completely rules out a Fed rate hike in May and continues to reflect a rate cut before the end of the year.,S&P,0.08,0.92,0.0,-0.2732,,,,,
2023-03-25,Bank of America: Money fund assets hit record high as investors are cashing out at the fastest pace since the epidemic.,S&P,0.0,0.922,0.078,0.1779,,,,,
2023-03-25,March 24 stock market views.,S&P,0.0,1.0,0.0,0.0,,,,,
2023-03-25,Deciphering the direction of the stock market after the confusing Powell speech.,S&P,0.147,0.853,0.0,-0.2263,,,,,
2023-03-25,Calls and Puts options.,S&P,0.0,1.0,0.0,0.0,,,,,
2023-03-25,Will further banks restrict transactions to exchanges like Coinbase?,S&P,0.215,0.579,0.207,-0.0258,,,,,
2023-03-25,S&P PMI Today - Daily Trading Report.,S&P,0.0,1.0,0.0,0.0,,,,,
2023-03-25,2/3 of QT has been reversed.,S&P,0.0,0.586,0.414,0.5473,,,,,
2023-03-25,Whenever we think we have it bad...,S&P,0.368,0.632,0.0,-0.5423,,,,,
2023-03-25,"Probably should've held judging from this morning, but can't be too upset (sold for 4.20).",S&P,0.0,0.835,0.165,0.4168,,,,,
2023-03-25,Microsoft-Activision merger CMA revision.,CMA,0.0,1.0,0.0,0.0,,,,,
2023-03-25,"A key indicator says a recession is guaranteed in 2023 — and Bill Ackman, Nouriel Roubini, and others are warning of trouble ahead.",S&P,0.283,0.717,0.0,-0.7845,,,,,
2023-03-25,"To my knowledge, wouldn't the vast majority of non-full-time investors just be better off by investing in the S&P 500?",S&P,0.0,0.868,0.132,0.4404,,,,,
2023-03-25,Please help. I have not slept in days. This is everything I have… I’m devastated… I was told the stock would be $1 soon. Should I get out?,S&P,0.0,0.839,0.161,0.6124,,,,,
2023-03-25,What's Your Worst Trade? Lessons Learned from Recent Bank Failures.,S&P,0.47,0.53,0.0,-0.7964,,,,,
2023-03-25,The Stock Market Hit a Pandemic Bottom 3 Years Ago. Here's How It Has Performed Since Then.,S&P,0.0,1.0,0.0,0.0,,,,,
2023-03-25,Uranium Energy Corp. (UEC) Falls -14.73 after a short report.,UEC,0.0,0.811,0.189,0.2732,,,,,
2023-03-25,"Am no saying the printer go brrrr, but the printer goes brrrrrrrrrrrrrrrrrrrrrrr!",S&P,0.147,0.853,0.0,-0.2244,,,,,
2023-03-25,"$AMBI to $15-20 in a few days, what you guys think? 🤷‍♂️🤷‍♂️",AMBI,0.0,1.0,0.0,0.0,,,,,
2023-03-25,Earnings recession on the way: 2023 SPX bottoms up EPS ests - financials expected to grow 21% 🤡 (source: modestproposal1 on Twitter).,S&P,0.113,0.887,0.0,-0.4215,,,,,
2023-03-25,Europe is f*cked.,S&P,0.0,1.0,0.0,0.0,,,,,
2023-03-25,Someone has a humiliation fetish.,S&P,0.481,0.519,0.0,-0.5719,,,,,
2023-03-25,When WorldCom 2.0.,S&P,0.0,1.0,0.0,0.0,,,,,
2023-03-25,On god.,S&P,0.0,0.323,0.677,0.2732,,,,,
2023-03-25,"Banks in 2008 vs 2023, what’s the difference?",S&P,0.0,1.0,0.0,0.0,,,,,
2023-03-25,"Wanting to buy Credit Suisse while they're dead, per se.",S&P,0.289,0.537,0.174,-0.4019,,,,,
2023-03-25,1.9% of Deposits is Not Systemic Collapse.,S&P,0.0,0.695,0.305,0.3875,,,,,
2023-03-25,Today is not a good day to die.,S&P,0.512,0.488,0.0,-0.7435,,,,,
2023-03-25,Market Recap | Stocks Edge Higher as Pressure on Banks Continues.,S&P,0.18,0.82,0.0,-0.296,,,,,
2023-03-25,Ford CEO: Tesla is going to see 'more price competition' in the EV market.,S&P,0.0,1.0,0.0,0.0,,,,,
2023-03-25,The Financial Crisis explained by Jack Mallers.,S&P,0.406,0.594,0.0,-0.6249,,,,,
2023-03-25,The OTHER Cramer indicator.,S&P,0.0,1.0,0.0,0.0,,,,,
2023-03-25,European bank stocks bear the brunt of recessionary trading in full swing.,S&P,0.0,1.0,0.0,0.0,,,,,
2023-03-25,Is it time to 1929 already? I was getting hungry for some soup.,S&P,0.0,1.0,0.0,0.0,,,,,
2023-03-25,"Potential crisis out of the European banking system, the dollar is starting to bounce!",S&P,0.253,0.747,0.0,-0.6588,,,,,
2023-03-25,"Bulls are back in control, The Ole Cup and Handle… 3-24-23 SPY/ ES Futures, and VIX Yield Weekly Market Analysis.",ES,0.0,1.0,0.0,0.0,,,,,
2023-03-25,JPOWs cure for inflation.,S&P,0.0,1.0,0.0,0.0,,,,,
2023-03-25,Would it be 2008 again?,S&P,0.0,1.0,0.0,0.0,,,,,
2023-03-25,"Dow Jones Index, future trades on Index, long, short.",S&P,0.0,1.0,0.0,0.0,,,,,
2023-03-25,LULU Earnings.,LULU,0.0,1.0,0.0,0.0,,,,,
2023-03-25,Markets Falling Before Deutsche Bank Bankruptcy Contagion Worries.,S&P,0.597,0.403,0.0,-0.7506,,,,,
2023-03-25,Danny Boy in talks with big banks?,S&P,0.0,1.0,0.0,0.0,,,,,
2023-03-25,The fed can't keep bailing banks out.,S&P,0.0,1.0,0.0,0.0,,,,,
2023-03-25,Taken from the securities portfolio section of Signature Bank's 2021 annual report. This aged well.,S&P,0.0,0.751,0.249,0.5106,,,,,
2023-03-25,Now Hiring Repo Men for the Pounding Banks and Dealers are Going to Feel Soon!,S&P,0.0,1.0,0.0,0.0,,,,,
2023-03-25,MercadoLibre Investment Thesis.,S&P,0.0,1.0,0.0,0.0,,,,,
2023-03-25,Square 1.5k to 14k overnight.,S&P,0.0,1.0,0.0,0.0,,,,,
2023-03-25,"What are you doing, Uncle Powell? 🌈🐻 gotta do what a 🌈🐻 gotta do.",S&P,0.0,1.0,0.0,0.0,,,,,
2023-03-25,Sometimes You Have To Trade The Fridge For The Upgrades.,S&P,0.0,1.0,0.0,0.0,,,,,
2023-03-25,PSQ vs SQQQ Volume.,S&P,0.0,1.0,0.0,0.0,,,,,
2023-03-25,'Bond Kings' Bill Gross and Jeffrey Gundlach predict an imminent US recession as surging interest rates strangle growth.,S&P,0.231,0.549,0.22,-0.0772,,,,,
2023-03-25,Brokerage at Schwab.,S&P,0.0,1.0,0.0,0.0,,,,,
2023-03-25,Down 87%… hoping the banks fall apart over the weekend.,S&P,0.0,0.763,0.237,0.4215,,,,,
2023-03-25,Busboys of WSB - how's business going?,S&P,0.0,1.0,0.0,0.0,,,,,
2023-03-25,2023-03-27 Wrinkle Brain Plays - In the style of Hermione Granger.,S&P,0.0,0.833,0.167,0.25,,,,,
2023-03-25,"Still waiting, Cathie.",S&P,0.0,1.0,0.0,0.0,,,,,
2023-03-25,Expected moves for next week.,S&P,0.0,1.0,0.0,0.0,,,,,
2023-03-25,"Good news, everyone!",S&P,0.0,0.385,0.615,0.4926,,,,,
