date,text,ticker,neg,neu,pos,compound,Returns_1,Returns_2,Returns_3,Returns_4,Returns_5
2023-03-16,Wrinkle-brain Plays (Mathematically derived options plays),S&P,0.0,0.5,0.5,0.4588,0.017562006217166637,0.010458524331151464,0.027107501314015403,0.025556814462448285,0.01070866090708833
2023-03-16,"SONY Stock Forecast, Price & News (Sony Group)",SONY,0.0,1.0,0.0,0.0,0.017562006217166637,0.010458524331151464,0.027107501314015403,0.025556814462448285,0.01070866090708833
2023-03-16,Credit Suisse = Lehman Brothers,S&P,0.0,0.606,0.394,0.3818,0.017562006217166637,0.010458524331151464,0.027107501314015403,0.025556814462448285,0.01070866090708833
2023-03-16,Credit Suisse to borrow up to about $54 billion from Swiss National Bank,S&P,0.0,0.822,0.178,0.3818,0.017562006217166637,0.010458524331151464,0.027107501314015403,0.025556814462448285,0.01070866090708833
2023-03-16,"""you met me at a very strange time in my life""",S&P,0.173,0.827,0.0,-0.2716,0.017562006217166637,0.010458524331151464,0.027107501314015403,0.025556814462448285,0.01070866090708833
2023-03-16,Gotta bankrupt them all,S&P,0.545,0.455,0.0,-0.5574,0.017562006217166637,0.010458524331151464,0.027107501314015403,0.025556814462448285,0.01070866090708833
2023-03-16,Recession Confirmed!,S&P,0.756,0.244,0.0,-0.4753,0.017562006217166637,0.010458524331151464,0.027107501314015403,0.025556814462448285,0.01070866090708833
2023-03-16,"Hey, bank for sale..! For sale?",S&P,0.0,1.0,0.0,0.0,0.017562006217166637,0.010458524331151464,0.027107501314015403,0.025556814462448285,0.01070866090708833
2023-03-16,Snap & Meta stock surges on report that Biden may ban TikTok,S&P,0.247,0.753,0.0,-0.5574,0.017562006217166637,0.010458524331151464,0.027107501314015403,0.025556814462448285,0.01070866090708833
2023-03-16,"First Republic Bank, is said to weigh options including a sale, per Bloomberg",S&P,0.0,1.0,0.0,0.0,0.017562006217166637,0.010458524331151464,0.027107501314015403,0.025556814462448285,0.01070866090708833
2023-03-16,Robinhood Users Say The Trading App Won’t Cash In Their Profitable Bets Against Silicon Valley Bank,S&P,0.0,0.838,0.162,0.4404,0.017562006217166637,0.010458524331151464,0.027107501314015403,0.025556814462448285,0.01070866090708833
2023-03-16,I how the recession isn't as deep as the yield inversion,S&P,0.219,0.781,0.0,-0.4215,0.017562006217166637,0.010458524331151464,0.027107501314015403,0.025556814462448285,0.01070866090708833
2023-03-16,How can I Sell an Eccomence in This crazy market?,S&P,0.234,0.766,0.0,-0.4118,0.017562006217166637,0.010458524331151464,0.027107501314015403,0.025556814462448285,0.01070866090708833
2023-03-16,Wen bankruptcy?,S&P,0.0,1.0,0.0,0.0,0.017562006217166637,0.010458524331151464,0.027107501314015403,0.025556814462448285,0.01070866090708833
2023-03-16,"The time of the bear has come, buckle up buckaroos 🐻",S&P,0.0,1.0,0.0,0.0,0.017562006217166637,0.010458524331151464,0.027107501314015403,0.025556814462448285,0.01070866090708833
2023-03-16,A simple calculation,S&P,0.0,1.0,0.0,0.0,0.017562006217166637,0.010458524331151464,0.027107501314015403,0.025556814462448285,0.01070866090708833
2023-03-16,"0DTE Gains Part 3: $150,000+",S&P,0.0,0.625,0.375,0.34,0.017562006217166637,0.010458524331151464,0.027107501314015403,0.025556814462448285,0.01070866090708833
2023-03-16,Eggon says “GME go up” after earnings. ⬆️,GME,0.0,1.0,0.0,0.0,0.050783725975105165,-0.008870468355044347,0.0005970285899603578,-0.028405783832937015,-0.04337900736441225
2023-03-16,Carlos Santana and Friends Solve Banking Crisis,S&P,0.315,0.308,0.377,-0.0516,0.017562006217166637,0.010458524331151464,0.027107501314015403,0.025556814462448285,0.01070866090708833
2023-03-16,Can you get an open record of all trades done on a particular day and who done them?,S&P,0.0,1.0,0.0,0.0,0.017562006217166637,0.010458524331151464,0.027107501314015403,0.025556814462448285,0.01070866090708833
2023-03-16,"$SPY potential bottom? Has been accumulating for past week, bottom of channel. I’m Bullish. SP500 $420 by 4/20.",S&P,0.0,1.0,0.0,0.0,0.017562006217166637,0.010458524331151464,0.027107501314015403,0.025556814462448285,0.01070866090708833
2023-03-16,SPY Stock,S&P,0.0,1.0,0.0,0.0,0.017562006217166637,0.010458524331151464,0.027107501314015403,0.025556814462448285,0.01070866090708833
2023-03-16,Biden reverses on TikTok,S&P,0.0,1.0,0.0,0.0,0.017562006217166637,0.010458524331151464,0.027107501314015403,0.025556814462448285,0.01070866090708833
2023-03-16,President Joe Biden on Monday underscored that the American banking system remains safe,S&P,0.0,0.805,0.195,0.4404,0.017562006217166637,0.010458524331151464,0.027107501314015403,0.025556814462448285,0.01070866090708833
2023-03-16,"It’s confirmed, Rivian has gone tits up!",S&P,0.268,0.732,0.0,-0.2942,0.017562006217166637,0.010458524331151464,0.027107501314015403,0.025556814462448285,0.01070866090708833
2023-03-16,Could a SVB's collapse been prevented if the accounting rules for recognizing bond losses were required to mark-to market?,S&P,0.257,0.696,0.048,-0.7003,0.017562006217166637,0.010458524331151464,0.027107501314015403,0.025556814462448285,0.01070866090708833
2023-03-16,Credit Suisse mooning tomorrow?,S&P,0.0,0.536,0.464,0.3818,0.017562006217166637,0.010458524331151464,0.027107501314015403,0.025556814462448285,0.01070866090708833
2023-03-16,"Virgin Orbit pauses operations for a week, furloughs nearly entire staff as it seeks funding",S&P,0.0,1.0,0.0,0.0,0.017562006217166637,0.010458524331151464,0.027107501314015403,0.025556814462448285,0.01070866090708833
2023-03-16,All this wishful thinking JPOW is suddenly their friend...,S&P,0.0,0.714,0.286,0.4939,0.017562006217166637,0.010458524331151464,0.027107501314015403,0.025556814462448285,0.01070866090708833
2023-03-16,FRC will recover aggressively and quickly,S&P,0.315,0.685,0.0,-0.3182,0.017562006217166637,0.010458524331151464,0.027107501314015403,0.025556814462448285,0.01070866090708833
2023-03-16,"Top changes to open interest calls and puts ((Wednesday, Mar. 15)",S&P,0.0,0.652,0.348,0.5859,0.017562006217166637,0.010458524331151464,0.027107501314015403,0.025556814462448285,0.01070866090708833
2023-03-16,Warning from the treasury market,S&P,0.333,0.417,0.25,-0.1531,0.017562006217166637,0.010458524331151464,0.027107501314015403,0.025556814462448285,0.01070866090708833
2023-03-16,Credit Suisse turmoil triggered a throwback to 2008,S&P,0.225,0.541,0.234,0.0258,0.017562006217166637,0.010458524331151464,0.027107501314015403,0.025556814462448285,0.01070866090708833
2023-03-16,"Why SVB is just the beginning: Part II Eurodollar edition, from a investment analyst",S&P,0.0,1.0,0.0,0.0,0.017562006217166637,0.010458524331151464,0.027107501314015403,0.025556814462448285,0.01070866090708833
2023-03-16,"What Are Your Moves Tomorrow, March 16, 2023",S&P,0.0,1.0,0.0,0.0,0.017562006217166637,0.010458524331151464,0.027107501314015403,0.025556814462448285,0.01070866090708833
2023-03-16,"The volatility continues… 3-15-23 SPY/ ES Futures, DXY, 10YR and VIX Daily Market Analysis",ES,0.0,1.0,0.0,0.0,-0.00026030516982356033,0.011457957896553905,0.02673796682355878,0.05378712878801606,0.03406498617268494
2023-03-16,Global Fixed Income Views 2Q 2023 by JP Morgan Asset Management,S&P,0.0,0.641,0.359,0.6166,0.017562006217166637,0.010458524331151464,0.027107501314015403,0.025556814462448285,0.01070866090708833
2023-03-16,Meta's 'Mega' Bullish Megaphone,S&P,0.0,1.0,0.0,0.0,0.017562006217166637,0.010458524331151464,0.027107501314015403,0.025556814462448285,0.01070866090708833
2023-03-16,Thoughts on WTI?,WTI,0.0,1.0,0.0,0.0,0.017562006217166637,0.010458524331151464,0.027107501314015403,0.025556814462448285,0.01070866090708833
2023-03-16,Who would have thought?,S&P,0.0,1.0,0.0,0.0,0.017562006217166637,0.010458524331151464,0.027107501314015403,0.025556814462448285,0.01070866090708833
2023-03-16,Swiss National Bank says it will provide Credit Suisse with liquidity if necessary,S&P,0.0,0.822,0.178,0.3818,0.017562006217166637,0.010458524331151464,0.027107501314015403,0.025556814462448285,0.01070866090708833
2023-03-16,Is this normal? Im new to trading. 3k to 20k,S&P,0.0,1.0,0.0,0.0,0.017562006217166637,0.010458524331151464,0.027107501314015403,0.025556814462448285,0.01070866090708833
2023-03-16,I'll just leave this here. - Credit derivatives house of the year: Credit Suisse,S&P,0.069,0.632,0.299,0.6124,0.017562006217166637,0.010458524331151464,0.027107501314015403,0.025556814462448285,0.01070866090708833
2023-03-16,"NVDA CFO just sold a bunch of stock, probably nothing.",NVDA,0.0,1.0,0.0,0.0,0.05419351555624341,0.06142209400068266,0.11212226591220076,0.11217074004032579,0.08981909454231318
2023-03-16,"Posted this earlier in the week, we’re failing to break down, imo pumps at the very least 3-4% before anymore downside",S&P,0.218,0.782,0.0,-0.6486,0.017562006217166637,0.010458524331151464,0.027107501314015403,0.025556814462448285,0.01070866090708833
2023-03-16,"143K gain riding the S&P rodeo. ES, SPX 0-days. Thanks Europe, keep it going!",ES,0.0,0.645,0.355,0.7644,-0.00026030516982356033,0.011457957896553905,0.02673796682355878,0.05378712878801606,0.03406498617268494
2023-03-16,"let me introduce you to the infinite Frosty glitch from Wendy - apply for their jobs, and get a free frosty whenever you're not selected.",S&P,0.0,0.879,0.121,0.5106,0.017562006217166637,0.010458524331151464,0.027107501314015403,0.025556814462448285,0.01070866090708833
2023-03-16,CNBC doing JPow dirty with this pic,S&P,0.326,0.674,0.0,-0.4404,0.017562006217166637,0.010458524331151464,0.027107501314015403,0.025556814462448285,0.01070866090708833
2023-03-16,How is the interest rate for loans made via the Bank Term Funding Program (BTFP) determined?,S&P,0.0,0.722,0.278,0.6597,0.017562006217166637,0.010458524331151464,0.027107501314015403,0.025556814462448285,0.01070866090708833
2023-03-16,Can someone help me understand what is going on with USAA?,S&P,0.0,0.787,0.213,0.4019,0.017562006217166637,0.010458524331151464,0.027107501314015403,0.025556814462448285,0.01070866090708833
2023-03-16,Switzerland faces pressure from at least one major government to intervene on Credit Suisse,S&P,0.131,0.714,0.155,0.1027,0.017562006217166637,0.010458524331151464,0.027107501314015403,0.025556814462448285,0.01070866090708833
2023-03-16,Breaking News via Bloomberg,S&P,0.0,1.0,0.0,0.0,0.017562006217166637,0.010458524331151464,0.027107501314015403,0.025556814462448285,0.01070866090708833
2023-03-16,Joseph Gentile Destroying Capitalism,S&P,0.545,0.455,0.0,-0.5574,0.017562006217166637,0.010458524331151464,0.027107501314015403,0.025556814462448285,0.01070866090708833
2023-03-16,How everyone is looking at CS right now...,S&P,0.0,1.0,0.0,0.0,0.017562006217166637,0.010458524331151464,0.027107501314015403,0.025556814462448285,0.01070866090708833
2023-03-16,"How to survive the next week and a half, a bear guide",S&P,0.0,1.0,0.0,0.0,0.017562006217166637,0.010458524331151464,0.027107501314015403,0.025556814462448285,0.01070866090708833
2023-03-16,Adjusted CET1 capital ratio for unrealised losses,S&P,0.31,0.69,0.0,-0.4019,0.017562006217166637,0.010458524331151464,0.027107501314015403,0.025556814462448285,0.01070866090708833
2023-03-16,#DWAC and Trump Media Being investigated for Money Laundering for Russians,DWAC,0.0,1.0,0.0,0.0,0.017562006217166637,0.010458524331151464,0.027107501314015403,0.025556814462448285,0.01070866090708833
2023-03-16,Carl Icahn explains Twitter.,S&P,0.0,1.0,0.0,0.0,0.017562006217166637,0.010458524331151464,0.027107501314015403,0.025556814462448285,0.01070866090708833
2023-03-16,"""Credit suisse is a great company""",S&P,0.0,0.374,0.626,0.7717,0.017562006217166637,0.010458524331151464,0.027107501314015403,0.025556814462448285,0.01070866090708833
2023-03-16,"FEDs are not bailing out banks, they are bailing out the bond market.",S&P,0.0,1.0,0.0,0.0,0.017562006217166637,0.010458524331151464,0.027107501314015403,0.025556814462448285,0.01070866090708833
2023-03-16,"(Pure speculation) I think J Pow confirms 25 base pts, or pause.",S&P,0.0,1.0,0.0,0.0,0.017562006217166637,0.010458524331151464,0.027107501314015403,0.025556814462448285,0.01070866090708833
2023-03-16,Here is a list of companies that are currently exposed to high levels of debt financing and the incoming credit crunch. Choose your short.,S&P,0.139,0.766,0.095,-0.0516,0.017562006217166637,0.010458524331151464,0.027107501314015403,0.025556814462448285,0.01070866090708833
2023-03-16,Life moves pretty fast when you're having fun,S&P,0.0,0.48,0.52,0.7579,0.017562006217166637,0.010458524331151464,0.027107501314015403,0.025556814462448285,0.01070866090708833
2023-03-16,The Roaring 20s,S&P,0.0,1.0,0.0,0.0,0.017562006217166637,0.010458524331151464,0.027107501314015403,0.025556814462448285,0.01070866090708833
2023-03-16,Jackson Hole 2.0 Speech Leak,S&P,0.375,0.625,0.0,-0.34,0.017562006217166637,0.010458524331151464,0.027107501314015403,0.025556814462448285,0.01070866090708833
2023-03-16,Credit Swiss' chairman has a very appropriate name,S&P,0.0,0.729,0.271,0.3818,0.017562006217166637,0.010458524331151464,0.027107501314015403,0.025556814462448285,0.01070866090708833
2023-03-16,#WAL buy at bottom :-),WAL,0.0,0.635,0.365,0.3182,0.017562006217166637,0.010458524331151464,0.027107501314015403,0.025556814462448285,0.01070866090708833
2023-03-16,am I nuts or is Nintendo the most undervalued stock on the market???,S&P,0.191,0.809,0.0,-0.4291,0.017562006217166637,0.010458524331151464,0.027107501314015403,0.025556814462448285,0.01070866090708833
2023-03-16,Banking crisis in a nut shell,S&P,0.451,0.549,0.0,-0.6249,0.017562006217166637,0.010458524331151464,0.027107501314015403,0.025556814462448285,0.01070866090708833
2023-03-16,Foolproof plan for women to gain financial success and freedom in 2023,S&P,0.0,0.365,0.635,0.9313,0.017562006217166637,0.010458524331151464,0.027107501314015403,0.025556814462448285,0.01070866090708833
2023-03-16,FRC 30B sunk cost fallacy: The leverage is on the wall st.,S&P,0.0,1.0,0.0,0.0,0.017562006217166637,0.010458524331151464,0.027107501314015403,0.025556814462448285,0.01070866090708833
2023-03-16,Is this a yolo? Quantum yolo $IONQ,IONQ,0.0,0.543,0.457,0.4939,0.017562006217166637,0.010458524331151464,0.027107501314015403,0.025556814462448285,0.01070866090708833
2023-03-16,"This post has been already terminated 3 times: 'Like 4chan found a Bloomberg Terminal', except we censor what we don't like all the time.",S&P,0.179,0.734,0.087,-0.3839,0.017562006217166637,0.010458524331151464,0.027107501314015403,0.025556814462448285,0.01070866090708833
2023-03-16,Doing the black ski run all the way to the bottom.......,S&P,0.0,1.0,0.0,0.0,0.017562006217166637,0.010458524331151464,0.027107501314015403,0.025556814462448285,0.01070866090708833
2023-03-16,$NVDA put yolo,NVDA,0.0,0.488,0.512,0.2732,0.05419351555624341,0.06142209400068266,0.11212226591220076,0.11217074004032579,0.08981909454231318
2023-03-16,Banking 101.,S&P,0.0,1.0,0.0,0.0,0.017562006217166637,0.010458524331151464,0.027107501314015403,0.025556814462448285,0.01070866090708833
2023-03-16,Bags of stones instead of nickel. They should do the Comex vaults next.,S&P,0.0,1.0,0.0,0.0,0.017562006217166637,0.010458524331151464,0.027107501314015403,0.025556814462448285,0.01070866090708833
2023-03-16,First republic bank to raise funds by issuing new shares despite already receiving $100 billion in funding,S&P,0.0,0.879,0.121,0.296,0.017562006217166637,0.010458524331151464,0.027107501314015403,0.025556814462448285,0.01070866090708833
2023-03-16,You're one to talk,S&P,0.0,1.0,0.0,0.0,0.017562006217166637,0.010458524331151464,0.027107501314015403,0.025556814462448285,0.01070866090708833
2023-03-16,UBS in talks to acquire Credit Suisse,UBS,0.0,0.698,0.302,0.3818,0.02829688732508262,-0.03651823664805831,-0.005165308797369095,-0.05309734098348273,-0.07978977792374742
2023-03-16,'One day i'll make millions instead of hot pockets' - me being over-optimistic (about my ability to afford hot pockets),S&P,0.0,0.892,0.108,0.3182,0.017562006217166637,0.010458524331151464,0.027107501314015403,0.025556814462448285,0.01070866090708833
2023-03-16,Will Marijuana Save Us?,S&P,0.0,0.484,0.516,0.4939,0.017562006217166637,0.010458524331151464,0.027107501314015403,0.025556814462448285,0.01070866090708833
2023-03-16,How are you guys trading this Price action?,S&P,0.0,1.0,0.0,0.0,0.017562006217166637,0.010458524331151464,0.027107501314015403,0.025556814462448285,0.01070866090708833
2023-03-16,"378 or 405.. what comes next? 3-17-23 SPY/ ES Futures, VIX, DXY and 10YR Yield Weekly Market Recap and Analysis",ES,0.0,1.0,0.0,0.0,-0.00026030516982356033,0.011457957896553905,0.02673796682355878,0.05378712878801606,0.03406498617268494
2023-03-16,I guess this is the right day for this meme? Or maybe wait a few more weeks?,S&P,0.0,1.0,0.0,0.0,0.017562006217166637,0.010458524331151464,0.027107501314015403,0.025556814462448285,0.01070866090708833
2023-03-16,US banks failure will cause crypto rush v.4.0,S&P,0.32,0.68,0.0,-0.5106,0.017562006217166637,0.010458524331151464,0.027107501314015403,0.025556814462448285,0.01070866090708833
2023-03-16,THE INVESTOOR,S&P,0.0,1.0,0.0,0.0,0.017562006217166637,0.010458524331151464,0.027107501314015403,0.025556814462448285,0.01070866090708833
2023-03-16,"Weekend Discussion Thread for the Weekend of March 18, 2023",S&P,0.0,1.0,0.0,0.0,0.017562006217166637,0.010458524331151464,0.027107501314015403,0.025556814462448285,0.01070866090708833
2023-03-16,Imagine,S&P,0.0,1.0,0.0,0.0,0.017562006217166637,0.010458524331151464,0.027107501314015403,0.025556814462448285,0.01070866090708833
2023-03-16,DO NOT hold near-expiry Puts on any stock that might collapse. Brokers are refusing to honor Puts on halted bank stocks…,S&P,0.218,0.664,0.118,-0.4019,0.017562006217166637,0.010458524331151464,0.027107501314015403,0.025556814462448285,0.01070866090708833
2023-03-16,YOU WILL LOSE 100%,S&P,0.534,0.466,0.0,-0.5319,0.017562006217166637,0.010458524331151464,0.027107501314015403,0.025556814462448285,0.01070866090708833
2023-03-16,Just bought ABR,ABR,0.0,1.0,0.0,0.0,0.017562006217166637,0.010458524331151464,0.027107501314015403,0.025556814462448285,0.01070866090708833
2023-03-16,Best buys right now,S&P,0.0,0.417,0.583,0.6369,0.017562006217166637,0.010458524331151464,0.027107501314015403,0.025556814462448285,0.01070866090708833
2023-03-16,The cycle of the market,S&P,0.0,1.0,0.0,0.0,0.017562006217166637,0.010458524331151464,0.027107501314015403,0.025556814462448285,0.01070866090708833
2023-03-16,What’s Gonna Happen Is That The Fed Is Going To Bail Out The Entire System,S&P,0.0,1.0,0.0,0.0,0.017562006217166637,0.010458524331151464,0.027107501314015403,0.025556814462448285,0.01070866090708833
2023-03-16,SVB Saga,S&P,0.0,1.0,0.0,0.0,0.017562006217166637,0.010458524331151464,0.027107501314015403,0.025556814462448285,0.01070866090708833
2023-03-16,"Most Anticipated Earnings Releases for the week beginning March 20th, 2023",S&P,0.0,1.0,0.0,0.0,0.017562006217166637,0.010458524331151464,0.027107501314015403,0.025556814462448285,0.01070866090708833
2023-03-16,"Fed poised to approve quarter-point rate hike next week, despite market turmoil",S&P,0.0,0.709,0.291,0.4784,0.017562006217166637,0.010458524331151464,0.027107501314015403,0.025556814462448285,0.01070866090708833
2023-03-16,"One of these days we'll figure it out, right? ...guys?",S&P,0.0,1.0,0.0,0.0,0.017562006217166637,0.010458524331151464,0.027107501314015403,0.025556814462448285,0.01070866090708833
2023-03-16,$BABA oversold? Buying calls,BABA,0.0,1.0,0.0,0.0,0.008710576197581421,-0.019439442851284516,-0.008202657330030338,-0.008919935775505983,-0.013793948518564192
2023-03-16,Red Crayons,S&P,0.0,1.0,0.0,0.0,0.017562006217166637,0.010458524331151464,0.027107501314015403,0.025556814462448285,0.01070866090708833
2023-03-16,How Jerome's Weekends Gonna Go,S&P,0.0,1.0,0.0,0.0,0.017562006217166637,0.010458524331151464,0.027107501314015403,0.025556814462448285,0.01070866090708833
2023-03-16,Could China ruin US hegemony this year?,S&P,0.388,0.612,0.0,-0.5859,0.017562006217166637,0.010458524331151464,0.027107501314015403,0.025556814462448285,0.01070866090708833
2023-03-16,How it feels,S&P,0.0,1.0,0.0,0.0,0.017562006217166637,0.010458524331151464,0.027107501314015403,0.025556814462448285,0.01070866090708833
2023-03-16,Noted... In the future only deposit into banks that can't fail,S&P,0.0,0.778,0.222,0.431,0.017562006217166637,0.010458524331151464,0.027107501314015403,0.025556814462448285,0.01070866090708833
2023-03-16,Fuck your calls and puts,S&P,0.467,0.533,0.0,-0.5423,0.017562006217166637,0.010458524331151464,0.027107501314015403,0.025556814462448285,0.01070866090708833
2023-03-16,JPOW did nothing wrong,S&P,0.0,0.54,0.46,0.3724,0.017562006217166637,0.010458524331151464,0.027107501314015403,0.025556814462448285,0.01070866090708833
2023-03-16,NVDA put,NVDA,0.0,1.0,0.0,0.0,0.05419351555624341,0.06142209400068266,0.11212226591220076,0.11217074004032579,0.08981909454231318
2023-03-16,WELP peeps there waiting and ready for the crash,S&P,0.221,0.574,0.205,-0.0516,0.017562006217166637,0.010458524331151464,0.027107501314015403,0.025556814462448285,0.01070866090708833
2023-03-16,Update from the fed,S&P,0.0,1.0,0.0,0.0,0.017562006217166637,0.010458524331151464,0.027107501314015403,0.025556814462448285,0.01070866090708833
2023-03-16,Summary of Yellen’s testimony yesterday,S&P,0.0,1.0,0.0,0.0,0.017562006217166637,0.010458524331151464,0.027107501314015403,0.025556814462448285,0.01070866090708833
2023-03-16,"The BOIL regard, post your porn loss!",S&P,0.302,0.698,0.0,-0.3802,0.017562006217166637,0.010458524331151464,0.027107501314015403,0.025556814462448285,0.01070866090708833
2023-03-16,Deal of the year 💸💸 already backed by Bank of America.,S&P,0.0,0.932,0.068,0.0258,0.017562006217166637,0.010458524331151464,0.027107501314015403,0.025556814462448285,0.01070866090708833
2023-03-16,How crazy was Silicon Valley Bank’s zero-hedge strategy?,S&P,0.255,0.745,0.0,-0.34,0.017562006217166637,0.010458524331151464,0.027107501314015403,0.025556814462448285,0.01070866090708833
2023-03-16,FRC moments after the money hits,S&P,0.0,1.0,0.0,0.0,0.017562006217166637,0.010458524331151464,0.027107501314015403,0.025556814462448285,0.01070866090708833
2023-03-16,USA vs China - currently,S&P,0.0,1.0,0.0,0.0,0.017562006217166637,0.010458524331151464,0.027107501314015403,0.025556814462448285,0.01070866090708833
2023-03-16,40K Stock YOLO on BAC,BAC,0.0,0.585,0.415,0.4278,0.017562006217166637,0.010458524331151464,0.027107501314015403,0.025556814462448285,0.01070866090708833
2023-03-16,How Jerome's Week Went,S&P,0.0,1.0,0.0,0.0,0.017562006217166637,0.010458524331151464,0.027107501314015403,0.025556814462448285,0.01070866090708833
2023-03-16,ready for that jpow energy,S&P,0.0,0.395,0.605,0.5574,0.017562006217166637,0.010458524331151464,0.027107501314015403,0.025556814462448285,0.01070866090708833
2023-03-17,"London (GB) economy maybe going down, but the islanders are getting drunk (LON:JDW) :D",GB,0.15,0.581,0.269,0.5345,-0.011019457310067593,0.006349025129309904,-0.0006761802413094431,0.01578933405043559,0.014255734926430508
2023-03-17,1.2k—>8.3k fdx calls,S&P,0.0,1.0,0.0,0.0,-0.011019457310067593,0.006349025129309904,-0.0006761802413094431,0.01578933405043559,0.014255734926430508
2023-03-17,Broader economic impact?,S&P,0.0,1.0,0.0,0.0,-0.011019457310067593,0.006349025129309904,-0.0006761802413094431,0.01578933405043559,0.014255734926430508
2023-03-17,The explosion of the US housing market (TERRIFYING OUTCOME),S&P,0.357,0.643,0.0,-0.6633,-0.011019457310067593,0.006349025129309904,-0.0006761802413094431,0.01578933405043559,0.014255734926430508
2023-03-17,Inflation Expectations 3.8% vs 4.1% last month. Consumer Expectations 63.4 vs 67 - SVB attention analysis.,S&P,0.0,1.0,0.0,0.0,-0.011019457310067593,0.006349025129309904,-0.0006761802413094431,0.01578933405043559,0.014255734926430508
2023-03-17,FedNow to come in July,S&P,0.0,1.0,0.0,0.0,-0.011019457310067593,0.006349025129309904,-0.0006761802413094431,0.01578933405043559,0.014255734926430508
2023-03-17,"$93k big bank yolo, too big to fail",S&P,0.302,0.517,0.181,-0.34,-0.011019457310067593,0.006349025129309904,-0.0006761802413094431,0.01578933405043559,0.014255734926430508
2023-03-17,WSB autist impresses the ladies,S&P,0.0,0.563,0.437,0.4767,-0.011019457310067593,0.006349025129309904,-0.0006761802413094431,0.01578933405043559,0.014255734926430508
2023-03-17,Credit Suisse getting desperate for liquidity,S&P,0.258,0.449,0.292,0.0772,-0.011019457310067593,0.006349025129309904,-0.0006761802413094431,0.01578933405043559,0.014255734926430508
2023-03-17,1... 2... FRED is coming for you...,S&P,0.0,1.0,0.0,0.0,-0.011019457310067593,0.006349025129309904,-0.0006761802413094431,0.01578933405043559,0.014255734926430508
2023-03-17,Holy volatility (1 sec chart),S&P,0.0,1.0,0.0,0.0,-0.011019457310067593,0.006349025129309904,-0.0006761802413094431,0.01578933405043559,0.014255734926430508
2023-03-17,FRC: Buy at open or wait for the dip?,S&P,0.0,1.0,0.0,0.0,-0.011019457310067593,0.006349025129309904,-0.0006761802413094431,0.01578933405043559,0.014255734926430508
2023-03-17,SPY YOLO profits from yesterday. Get ready for more dick today Bers!,S&P,0.179,0.398,0.424,0.6036,-0.011019457310067593,0.006349025129309904,-0.0006761802413094431,0.01578933405043559,0.014255734926430508
2023-03-17,So why can't the Fed just print infinite money?,S&P,0.0,1.0,0.0,0.0,-0.011019457310067593,0.006349025129309904,-0.0006761802413094431,0.01578933405043559,0.014255734926430508
2023-03-17,Jamie Saves,S&P,0.0,1.0,0.0,0.0,-0.011019457310067593,0.006349025129309904,-0.0006761802413094431,0.01578933405043559,0.014255734926430508
2023-03-17,CDR one of the strongest on Polish WIG20,S&P,0.0,0.707,0.293,0.4404,-0.011019457310067593,0.006349025129309904,-0.0006761802413094431,0.01578933405043559,0.014255734926430508
