date,text,ticker,neg,neu,pos,compound,Returns_1,Returns_2,Returns_3,Returns_4,Returns_5
2023-06-23,+$10k to -$23k in a flash. This time will be different.,S&P,0.0,1.0,0.0,0.0,-0.007658808766684566,-0.003976430647674056,-0.009200854732235308,-0.013892395391790768,-0.017513007330000052
2023-06-23,Defense Stock Portfolios,S&P,0.0,0.571,0.429,0.128,-0.007658808766684566,-0.003976430647674056,-0.009200854732235308,-0.013892395391790768,-0.017513007330000052
2023-06-23,6=22=23 Volume moving tickers,S&P,0.0,1.0,0.0,0.0,-0.007658808766684566,-0.003976430647674056,-0.009200854732235308,-0.013892395391790768,-0.017513007330000052
2023-06-23,New TSLA Investors,TSLA,0.0,1.0,0.0,0.0,-0.030270888067223778,-0.01102283760792333,-0.06503918859384306,-0.015122446887948615,0.002735491300223991
2023-06-23,Some humor to start your day. My Wendy’s resume 😉 Diamond hands 🙌🏻 💎,S&P,0.0,0.8,0.2,0.5423,-0.007658808766684566,-0.003976430647674056,-0.009200854732235308,-0.013892395391790768,-0.017513007330000052
2023-06-23,Bank of England surprises with 50-basis-point rate hike to tackle persistent inflation,S&P,0.0,0.853,0.147,0.2263,-0.007658808766684566,-0.003976430647674056,-0.009200854732235308,-0.013892395391790768,-0.017513007330000052
2023-06-23,"What happens when the Boomers start getting absolutely MILKED by the Nursing Homes/HC system, run out of money and sell all their assets?",S&P,0.0,0.928,0.072,0.1779,-0.007658808766684566,-0.003976430647674056,-0.009200854732235308,-0.013892395391790768,-0.017513007330000052
2023-06-23,"Tesla downgraded by Morgan Stanley, could this be a time to buy puts?",S&P,0.0,1.0,0.0,0.0,-0.007658808766684566,-0.003976430647674056,-0.009200854732235308,-0.013892395391790768,-0.017513007330000052
2023-06-23,"Daily Discussion Thread for June 22, 2023",S&P,0.0,1.0,0.0,0.0,-0.007658808766684566,-0.003976430647674056,-0.009200854732235308,-0.013892395391790768,-0.017513007330000052
2023-06-23,Does anyone have access to historical year-wise data for the components of the Nifty/nifty infra Index?,S&P,0.0,1.0,0.0,0.0,-0.007658808766684566,-0.003976430647674056,-0.009200854732235308,-0.013892395391790768,-0.017513007330000052
2023-06-23,Tesla bulls to their brokers after Thursday,S&P,0.0,1.0,0.0,0.0,-0.007658808766684566,-0.003976430647674056,-0.009200854732235308,-0.013892395391790768,-0.017513007330000052
2023-06-23,Short Bets on US Stocks Hit $1 Trillion,S&P,0.0,1.0,0.0,0.0,-0.007658808766684566,-0.003976430647674056,-0.009200854732235308,-0.013892395391790768,-0.017513007330000052
2023-06-23,"Ghey bers singing: ""when the VIX is low, look out below.""",S&P,0.174,0.826,0.0,-0.2732,-0.007658808766684566,-0.003976430647674056,-0.009200854732235308,-0.013892395391790768,-0.017513007330000052
2023-06-23,"US sharemarket: Short bets on US stocks hit $1.5 trn, most since April 2022",S&P,0.0,1.0,0.0,0.0,-0.007658808766684566,-0.003976430647674056,-0.009200854732235308,-0.013892395391790768,-0.017513007330000052
2023-06-23,WSB Hater of the Year Award Ceremony,S&P,0.248,0.442,0.31,0.1779,-0.007658808766684566,-0.003976430647674056,-0.009200854732235308,-0.013892395391790768,-0.017513007330000052
2023-06-23,Ex-Goldman Banker Convicted of Passing Insider Tips to Squash Pal-Turned-Informant,S&P,0.0,1.0,0.0,0.0,-0.007658808766684566,-0.003976430647674056,-0.009200854732235308,-0.013892395391790768,-0.017513007330000052
2023-06-23,Inflation will keep going up for eternity,S&P,0.0,1.0,0.0,0.0,-0.007658808766684566,-0.003976430647674056,-0.009200854732235308,-0.013892395391790768,-0.017513007330000052
2023-06-23,So calls should continue to print?,S&P,0.0,1.0,0.0,0.0,-0.007658808766684566,-0.003976430647674056,-0.009200854732235308,-0.013892395391790768,-0.017513007330000052
2023-06-23,Any other regards on MCK?,MCK,0.0,1.0,0.0,0.0,-0.007658808766684566,-0.003976430647674056,-0.009200854732235308,-0.013892395391790768,-0.017513007330000052
2023-06-23,$TSLA Bulls Rejoice,TSLA,0.0,0.408,0.592,0.4404,-0.030270888067223778,-0.01102283760792333,-0.06503918859384306,-0.015122446887948615,0.002735491300223991
2023-06-23,Bears enjoy it while it last!,S&P,0.0,0.589,0.411,0.5411,-0.007658808766684566,-0.003976430647674056,-0.009200854732235308,-0.013892395391790768,-0.017513007330000052
2023-06-25,Elon Musk Says It Would ‘not Be Legal For Me To Speculate About A Starlink IPO’—but It’ll Make The World’s Richest Man Even Richer,S&P,0.0,0.717,0.283,0.8074,,,,,
2023-06-25,Here we go again! (Socialist economists like Krugman don’t understand the power of innovation and expanding consumer choices),S&P,0.0,0.748,0.252,0.6588,,,,,
2023-06-25,Am I a Real Trader Yet?,S&P,0.0,1.0,0.0,0.0,,,,,
2023-06-25,"Russia turmoil to fuel market volatility, flight to safety",S&P,0.203,0.569,0.228,0.0772,,,,,
2023-06-25,"Patient bears, the time is coming",S&P,0.0,1.0,0.0,0.0,,,,,
2023-06-25,How everyone who locked in < 3% interest rates on their homes are feeling rn looking at the housing market,S&P,0.0,0.8,0.2,0.5423,,,,,
2023-06-25,found my new side hustle,S&P,0.0,1.0,0.0,0.0,,,,,
2023-06-25,Shorting TQQQ using options,S&P,0.0,1.0,0.0,0.0,,,,,
2023-06-25,"SPY Technical Analysis for Monday June 26, 2023 A Closer Look at SPY's Bearish Short-Term Trend: Key Levels and Potential Reversal Zones",S&P,0.0,1.0,0.0,0.0,,,,,
2023-06-25,My never-to-be lambo is gonna be so lit 🔥,S&P,0.251,0.749,0.0,-0.3976,,,,,
2023-06-25,"Seabreeze Capital - Going long cannabis - MSOS, Trulieve, Greenthumb on re-schedule + banking reform by yr end",S&P,0.0,1.0,0.0,0.0,,,,,
2023-06-25,Can’t go tits up,S&P,0.388,0.612,0.0,-0.2263,,,,,
2023-06-25,Poots on russia?,S&P,0.0,1.0,0.0,0.0,,,,,
2023-06-25,YOLO BOLO AMD POOTS,AMD,0.0,0.588,0.412,0.2732,,,,,
2023-06-25,Follow your heart,S&P,0.0,0.323,0.677,0.6369,,,,,
2023-06-25,LOST 11k in four days and blew my account.,S&P,0.275,0.725,0.0,-0.4648,,,,,
2023-06-25,"Investors are gripped by fears of a recession, leading to a decline in global markets",S&P,0.301,0.699,0.0,-0.6808,,,,,
2023-06-25,How to tank the world economy in 3 easy steps 🐻🐻🐻,S&P,0.0,0.838,0.162,0.4404,,,,,
2023-06-25,Russian Roulette,S&P,0.0,1.0,0.0,0.0,,,,,
2023-06-25,Jensen Huang finally sold some NVDA stock.,NVDA,0.0,1.0,0.0,0.0,,,,,
2023-06-25,Assigned Put I sold as part of a Put Credit Spread that expires 7/21/23 $AVTR,AVTR,0.0,0.843,0.157,0.3818,,,,,
2023-06-25,That was fast. Indian PM gets wish granted in record time. 🇮🇳📈 Amazon commits 15B to Indian development.,PM,0.0,0.681,0.319,0.6705,,,,,
2023-06-25,"Here is to all my fellow degenerates, who also bought calls Friday, before waking up to a Russian civil war.. GUH",S&P,0.163,0.837,0.0,-0.5994,,,,,
2023-06-25,"This qualifies as wallstreetbets, right?",S&P,0.0,1.0,0.0,0.0,,,,,
2023-06-25,Choose Your Fighter 🚨,S&P,0.0,0.758,0.242,0.1531,,,,,
2023-06-25,Tesla Gains this month,S&P,0.0,0.556,0.444,0.34,,,,,
2023-06-25,Long $ROPE if this doesn’t bounce,S&P,0.0,1.0,0.0,0.0,,,,,
2023-06-25,Latecomers to 40% Tech Stock Rally Arrive in Time to See It Fade,S&P,0.0,1.0,0.0,0.0,,,,,
2023-06-25,Grinding Back to Even,S&P,0.0,1.0,0.0,0.0,,,,,
2023-06-25,NDAQ 34@49.40 bet. St. Patrick told me it goes up 75%.,NDAQ,0.0,1.0,0.0,0.0,,,,,
2023-06-25,Come on now - who did this?,S&P,0.0,1.0,0.0,0.0,,,,,
2023-06-25,"Short C3.AI YOLO, 2nd day",S&P,0.0,0.585,0.415,0.4278,,,,,
2023-06-25,So we didn't only bailout banks we bailed out large hedge funds as well.,S&P,0.0,0.779,0.221,0.3391,,,,,
2023-06-25,KMX daily business trend insight,KMX,0.0,1.0,0.0,0.0,,,,,
2023-06-25,Puts on Nikola,S&P,0.0,1.0,0.0,0.0,,,,,
2023-06-25,"Weekend Discussion Thread for the Weekend of June 24, 2023",S&P,0.0,1.0,0.0,0.0,,,,,
2023-06-25,"Temu has been caught by congress using slave labor and a shipping loop-hole, PDD the owner is probably gonna crash hard this week",PDD,0.163,0.837,0.0,-0.4767,,,,,
2023-06-25,40K $CVNA Put Play | Expiration 07/07 | 20.00 Strike | 330 Contracts,CVNA,0.101,0.738,0.161,0.2263,,,,,
2023-06-25,A Short Thesis Against $TFIN: Questionable Valuation and Industry Risks,TFIN,0.35,0.65,0.0,-0.5106,,,,,
2023-06-25,I'm going long on $ENVX,ENVX,0.0,1.0,0.0,0.0,,,,,
2023-06-30,"F NVDA, F RH , F market maker, FML","NVDA, RH",0.0,1.0,0.0,0.0,0.012269004495714109,0.016797435108222514,0.016437410839586608,0.028081570388688748,0.02346873463007748
2023-06-30,Find the one you can’t live without,S&P,0.0,1.0,0.0,0.0,0.012269004495714109,0.016797435108222514,0.016437410839586608,0.028081570388688748,0.02346873463007748
2023-06-30,Interview with a WSB Member,S&P,0.0,1.0,0.0,0.0,0.012269004495714109,0.016797435108222514,0.016437410839586608,0.028081570388688748,0.02346873463007748
2023-06-30,Core PCE is up .3 % which means the only Question now is how high will Powell raise rates at the next FOMC meeting,S&P,0.0,1.0,0.0,0.0,0.012269004495714109,0.016797435108222514,0.016437410839586608,0.028081570388688748,0.02346873463007748
2023-06-30,"Apple has once again become the world's biggest company, with a staggering valuation of $3 trillion - ProfessPost",S&P,0.0,1.0,0.0,0.0,0.012269004495714109,0.016797435108222514,0.016437410839586608,0.028081570388688748,0.02346873463007748
2023-06-30,IonQ Partners with South Korea’s Ministry of Science and ICT to Boost Regional Quantum Computing Ecosystem and Cultivate Quantum Talent,S&P,0.0,0.766,0.234,0.6705,0.012269004495714109,0.016797435108222514,0.016437410839586608,0.028081570388688748,0.02346873463007748
2023-06-30,Tesla float getting close to 0,S&P,0.0,1.0,0.0,0.0,0.012269004495714109,0.016797435108222514,0.016437410839586608,0.028081570388688748,0.02346873463007748
2023-06-30,"Daily Discussion Thread for June 30, 2023",S&P,0.0,1.0,0.0,0.0,0.012269004495714109,0.016797435108222514,0.016437410839586608,0.028081570388688748,0.02346873463007748
2023-06-30,Danaos (DAC)- The Richest Company on Earth,DAC,0.0,0.638,0.362,0.5267,0.012269004495714109,0.016797435108222514,0.016437410839586608,0.028081570388688748,0.02346873463007748
2023-06-30,Six questions facing US stock investors as 2023's second half nears.,S&P,0.0,1.0,0.0,0.0,0.012269004495714109,0.016797435108222514,0.016437410839586608,0.028081570388688748,0.02346873463007748
2023-06-30,Space companies,S&P,0.0,1.0,0.0,0.0,0.012269004495714109,0.016797435108222514,0.016437410839586608,0.028081570388688748,0.02346873463007748
2023-06-30,"I know we like to joke about Cramer, but as we can see from SJIM’s chart, it’s also not wise to inverse everything he says",S&P,0.116,0.767,0.117,-0.2455,0.012269004495714109,0.016797435108222514,0.016437410839586608,0.028081570388688748,0.02346873463007748
2023-06-30,Jpow stroking the markets once a month. Up & down,S&P,0.0,1.0,0.0,0.0,0.012269004495714109,0.016797435108222514,0.016437410839586608,0.028081570388688748,0.02346873463007748
2023-06-30,Updated TimeLine for Microsoft Activison Deal,S&P,0.0,1.0,0.0,0.0,0.012269004495714109,0.016797435108222514,0.016437410839586608,0.028081570388688748,0.02346873463007748
2023-06-30,Saw this last night at the Oakland A’s Coliseum during the perfect game. Felt that this also would be right at home here.,S&P,0.0,0.856,0.144,0.5719,0.012269004495714109,0.016797435108222514,0.016437410839586608,0.028081570388688748,0.02346873463007748
2023-06-30,Guys What Happened with SPCE today? Today the launch went successful but the moment it started to come down it dropped 10%.,SPCE,0.0,0.897,0.103,0.34,-0.08274229386628473,-0.18143453548614252,-0.10599078847328613,-0.06280187449991126,-0.10599078847328613
2023-06-30,Prime wsb real estate,S&P,0.0,1.0,0.0,0.0,0.012269004495714109,0.016797435108222514,0.016437410839586608,0.028081570388688748,0.02346873463007748
2023-06-30,"How does WSB like NVO (Novo Nordisk, makers of Ozempic)?",NVO,0.0,0.783,0.217,0.3612,0.012269004495714109,0.016797435108222514,0.016437410839586608,0.028081570388688748,0.02346873463007748
2023-06-30,The Future of investment expertise,S&P,0.0,1.0,0.0,0.0,0.012269004495714109,0.016797435108222514,0.016437410839586608,0.028081570388688748,0.02346873463007748
2023-06-30,I’m sick of these lame ass loss porns…. THIS IS WHAT REAL LOSS PORN LOOKS LIKE! (Don’t worry I was +45% green today),S&P,0.485,0.428,0.087,-0.9312,0.012269004495714109,0.016797435108222514,0.016437410839586608,0.028081570388688748,0.02346873463007748
2023-06-30,Odds released for Battle of the Billionaires cage fight: Who you got?,S&P,0.342,0.658,0.0,-0.6369,0.012269004495714109,0.016797435108222514,0.016437410839586608,0.028081570388688748,0.02346873463007748
2023-06-30,AMC Shareholder’s Meeting,AMC,0.0,1.0,0.0,0.0,-0.0045248824844553726,-0.002267517548905529,0.07317077992999343,0.09181138121495969,0.09725681900879701
2023-06-30,How fucked am I?,S&P,0.595,0.405,0.0,-0.6597,0.012269004495714109,0.016797435108222514,0.016437410839586608,0.028081570388688748,0.02346873463007748
2023-06-30,Sriracha shortage sees sauce prices spike to over $70 a bottle,S&P,0.167,0.833,0.0,-0.25,0.012269004495714109,0.016797435108222514,0.016437410839586608,0.028081570388688748,0.02346873463007748
2023-06-30,Money. Printer. Go. BRRRRRRRRRRRRRRRRRRRRRRRRRRRRRRRRRRRRRRRR,S&P,0.0,1.0,0.0,0.0,0.012269004495714109,0.016797435108222514,0.016437410839586608,0.028081570388688748,0.02346873463007748
2023-06-30,I didnt hear no bell ( randy marsh voice ),S&P,0.0,0.827,0.173,0.2235,0.012269004495714109,0.016797435108222514,0.016437410839586608,0.028081570388688748,0.02346873463007748
2023-06-30,This is seriously hurting my self-esteem,S&P,0.524,0.476,0.0,-0.5267,0.012269004495714109,0.016797435108222514,0.016437410839586608,0.028081570388688748,0.02346873463007748
2023-06-30,"Compliance chief at Chinese fintech stole girlfriend’s insider info to trade VMware, tech stocks",S&P,0.0,1.0,0.0,0.0,0.012269004495714109,0.016797435108222514,0.016437410839586608,0.028081570388688748,0.02346873463007748
2023-06-30,Nvidia is going to $320,S&P,0.0,1.0,0.0,0.0,0.012269004495714109,0.016797435108222514,0.016437410839586608,0.028081570388688748,0.02346873463007748
2023-06-30,"After years of practice in the stock market, I’ve decided to apply my “wisdom” and “invest” in other channels. WCGW?",S&P,0.0,1.0,0.0,0.0,0.012269004495714109,0.016797435108222514,0.016437410839586608,0.028081570388688748,0.02346873463007748
2023-06-30,The next great short CAVA,S&P,0.0,0.494,0.506,0.6249,0.012269004495714109,0.016797435108222514,0.016437410839586608,0.028081570388688748,0.02346873463007748
2023-06-30,Ride or die stock out side the s&p 500?,S&P,0.328,0.672,0.0,-0.5994,0.012269004495714109,0.016797435108222514,0.016437410839586608,0.028081570388688748,0.02346873463007748
2023-06-30,Nikola Corp Says Received Notice From Nasdaq Informing Co That It Has Regained Compliance With Nasdaq Listing Rule 5450(A)(1),S&P,0.0,1.0,0.0,0.0,0.012269004495714109,0.016797435108222514,0.016437410839586608,0.028081570388688748,0.02346873463007748
2023-06-30,Thoughts on this stocks situation,S&P,0.0,1.0,0.0,0.0,0.012269004495714109,0.016797435108222514,0.016437410839586608,0.028081570388688748,0.02346873463007748
2023-06-30,"Even Wendy’s wont accept me, welp!",S&P,0.331,0.669,0.0,-0.3561,0.012269004495714109,0.016797435108222514,0.016437410839586608,0.028081570388688748,0.02346873463007748
2023-06-30,"What Are Your Moves Tomorrow, June 30, 2023",S&P,0.0,1.0,0.0,0.0,0.012269004495714109,0.016797435108222514,0.016437410839586608,0.028081570388688748,0.02346873463007748
2023-06-30,ATVI hearing / insurance play,ATVI,0.0,0.625,0.375,0.34,0.012269004495714109,0.016797435108222514,0.016437410839586608,0.028081570388688748,0.02346873463007748
2023-06-30,Goodbye Overstock.com. Hello Bedbathandbeyond.com,S&P,0.0,1.0,0.0,0.0,0.012269004495714109,0.016797435108222514,0.016437410839586608,0.028081570388688748,0.02346873463007748
2023-06-30,AbCellera (ABCL): The AI-Powered Drug Discovery Gem You've Been Snoozing On - An Easy 2x Play - DD,"ABCL, DD",0.0,0.751,0.249,0.6486,0.012269004495714109,0.016797435108222514,0.016437410839586608,0.028081570388688748,0.02346873463007748
2023-06-30,Virgin Galactic Completes First Commercial Spaceflight,S&P,0.0,1.0,0.0,0.0,0.012269004495714109,0.016797435108222514,0.016437410839586608,0.028081570388688748,0.02346873463007748
2023-06-30,NKE Earnings are Today and this is how you'll make money on it.,NKE,0.0,1.0,0.0,0.0,0.012269004495714109,0.016797435108222514,0.016437410839586608,0.028081570388688748,0.02346873463007748
2023-06-30,Potential Trading Opportunity on Microsoft Activision Deal,S&P,0.0,0.682,0.318,0.4215,0.012269004495714109,0.016797435108222514,0.016437410839586608,0.028081570388688748,0.02346873463007748
2023-06-30,"$50,000 RIVN YOLO. These ghey bers don’t know who they fuckin with",RIVN,0.0,0.795,0.205,0.4278,0.04059960082684344,0.13797810496709917,0.19512197624858318,0.23866171625784993,0.23133778094713753
2023-06-30,Siemens Energy's shares plummet over 37% due to increasing worries about wind turbine performance - ProfessPost,S&P,0.147,0.737,0.116,-0.1531,0.012269004495714109,0.016797435108222514,0.016437410839586608,0.028081570388688748,0.02346873463007748
2023-06-30,WSB Dad supports his son,S&P,0.0,0.615,0.385,0.3612,0.012269004495714109,0.016797435108222514,0.016437410839586608,0.028081570388688748,0.02346873463007748
2023-06-30,"Big US banks would lose $541bn in doomsday scenario, predicts Fed",S&P,0.419,0.581,0.0,-0.7579,0.012269004495714109,0.016797435108222514,0.016437410839586608,0.028081570388688748,0.02346873463007748
2023-06-30,"JPMorgan Chase is fined by SEC after ""mistakenly"" deleting 47 million emails",S&P,0.167,0.833,0.0,-0.296,0.012269004495714109,0.016797435108222514,0.016437410839586608,0.028081570388688748,0.02346873463007748
2023-06-30,Tesla sales explode in Australia - with the marque close to running out of stock and it taking a major sales crown from Toyota,S&P,0.0,1.0,0.0,0.0,0.012269004495714109,0.016797435108222514,0.016437410839586608,0.028081570388688748,0.02346873463007748
2023-06-30,Thank you to USAA Insurance for sponsoring these trades with my insurance money. My car will never drive again....,S&P,0.0,0.878,0.122,0.3612,0.012269004495714109,0.016797435108222514,0.016437410839586608,0.028081570388688748,0.02346873463007748
2023-06-30,"Daily Discussion Thread for June 29, 2023",S&P,0.0,1.0,0.0,0.0,0.012269004495714109,0.016797435108222514,0.016437410839586608,0.028081570388688748,0.02346873463007748
2023-06-30,Bank of America nurses $100bn paper loss after big bet in bond market,S&P,0.161,0.839,0.0,-0.3182,0.012269004495714109,0.016797435108222514,0.016437410839586608,0.028081570388688748,0.02346873463007748
2023-06-30,My therapist tells me to join this sub. Why?,S&P,0.0,0.784,0.216,0.296,0.012269004495714109,0.016797435108222514,0.016437410839586608,0.028081570388688748,0.02346873463007748
2023-06-30,The infinite wisdom of AutoModerator has been bestowed on us.,S&P,0.0,0.726,0.274,0.5267,0.012269004495714109,0.016797435108222514,0.016437410839586608,0.028081570388688748,0.02346873463007748
2023-06-30,Someone Get This Guy the Nobel Prize in Economics,S&P,0.0,0.708,0.292,0.5106,0.012269004495714109,0.016797435108222514,0.016437410839586608,0.028081570388688748,0.02346873463007748
2023-06-30,Are we in a bubble ? Are you a bull or bear?,S&P,0.0,1.0,0.0,0.0,0.012269004495714109,0.016797435108222514,0.016437410839586608,0.028081570388688748,0.02346873463007748
2023-06-30,Zillow Doesn't Know Shit About Real Estate - Insider Selling Looks Like A Bloodbath,S&P,0.0,0.689,0.311,0.6623,0.012269004495714109,0.016797435108222514,0.016437410839586608,0.028081570388688748,0.02346873463007748
2023-06-30,Nissan reportedly spied on former COO As CEO searched for leverage,COO,0.0,1.0,0.0,0.0,0.012269004495714109,0.016797435108222514,0.016437410839586608,0.028081570388688748,0.02346873463007748
2023-06-30,My life is over. What have I done,S&P,0.0,1.0,0.0,0.0,0.012269004495714109,0.016797435108222514,0.016437410839586608,0.028081570388688748,0.02346873463007748
2023-06-30,Powell Calls for Stronger Bank Regulation and Supervision,S&P,0.0,0.729,0.271,0.3818,0.012269004495714109,0.016797435108222514,0.016437410839586608,0.028081570388688748,0.02346873463007748
2023-06-30,Micron Delivers Strong Forecast in Sign That Chip Glut Is Easing,S&P,0.0,0.629,0.371,0.6486,0.012269004495714109,0.016797435108222514,0.016437410839586608,0.028081570388688748,0.02346873463007748
2023-06-30,Its time to short semis,S&P,0.0,1.0,0.0,0.0,0.012269004495714109,0.016797435108222514,0.016437410839586608,0.028081570388688748,0.02346873463007748
2023-06-30,Teamsters: Nationwide UPS Strike is Imminent,UPS,0.231,0.769,0.0,-0.128,0.01817663670986369,0.020437186969414878,0.026220884405258937,0.0376266280752533,0.05883399556306235
2023-06-30,AMC in court,AMC,0.0,1.0,0.0,0.0,-0.0045248824844553726,-0.002267517548905529,0.07317077992999343,0.09181138121495969,0.09725681900879701
2023-06-30,$ETRN Equitrans has amazing value right now,ETRN,0.0,0.446,0.554,0.7351,0.012269004495714109,0.016797435108222514,0.016437410839586608,0.028081570388688748,0.02346873463007748
2023-06-30,US launches 7 bln solar program.,S&P,0.0,1.0,0.0,0.0,0.012269004495714109,0.016797435108222514,0.016437410839586608,0.028081570388688748,0.02346873463007748
2023-06-30,IV tanks but RV goes up ?,S&P,0.0,1.0,0.0,0.0,0.012269004495714109,0.016797435108222514,0.016437410839586608,0.028081570388688748,0.02346873463007748
2023-06-30,"It'll be fine, most likely, right?",S&P,0.0,0.735,0.265,0.2023,0.012269004495714109,0.016797435108222514,0.016437410839586608,0.028081570388688748,0.02346873463007748
2023-06-30,Musk vs Zuckerberg. The fight of the Century !!!,S&P,0.303,0.697,0.0,-0.5386,0.012269004495714109,0.016797435108222514,0.016437410839586608,0.028081570388688748,0.02346873463007748
2023-06-30,HES ALIVE!! CVNA 🌕 $30+ this week,"CVNA, HES",0.0,0.641,0.359,0.6016,0.012269004495714109,0.016797435108222514,0.016437410839586608,0.028081570388688748,0.02346873463007748
2023-06-30,"Most want a Lambo, but Ferrari is more my taste.",S&P,0.0,0.874,0.126,0.0763,0.012269004495714109,0.016797435108222514,0.016437410839586608,0.028081570388688748,0.02346873463007748
2023-06-30,VIX is for kicks,S&P,0.0,1.0,0.0,0.0,0.012269004495714109,0.016797435108222514,0.016437410839586608,0.028081570388688748,0.02346873463007748
2023-06-30,Federal Reserve says 23 biggest banks weathered severe recession scenario in stress test,S&P,0.451,0.549,0.0,-0.802,0.012269004495714109,0.016797435108222514,0.016437410839586608,0.028081570388688748,0.02346873463007748
2023-06-30,"WSB initiation, loss porn",S&P,0.434,0.566,0.0,-0.3182,0.012269004495714109,0.016797435108222514,0.016437410839586608,0.028081570388688748,0.02346873463007748
2023-06-30,Rtx guy again,S&P,0.0,1.0,0.0,0.0,0.012269004495714109,0.016797435108222514,0.016437410839586608,0.028081570388688748,0.02346873463007748
2023-06-30,"What Are Your Moves Tomorrow, June 29, 2023",S&P,0.0,1.0,0.0,0.0,0.012269004495714109,0.016797435108222514,0.016437410839586608,0.028081570388688748,0.02346873463007748
2023-06-30,"YTD Performance of the S&P 500 & NASDAQ vs. the Magnificent 7 (Apple $AAPL, Microsoft $MSFT, Google $GOOGL, Amazon $AMZN, Nvidia $NVDA, Tesl","AAPL, AMZN, GOOGL, MSFT, NVDA",0.0,0.789,0.211,0.6808,0.012269004495714109,0.016797435108222514,0.016437410839586608,0.028081570388688748,0.02346873463007748
2023-06-30,Virgin galactic first commercial space flight tomorrow,S&P,0.0,1.0,0.0,0.0,0.012269004495714109,0.016797435108222514,0.016437410839586608,0.028081570388688748,0.02346873463007748
2023-06-30,🏆 🏆 Unveiling the Fed's Playbook: Crystal Ball of Inflation Predictions 🔮 🔮,S&P,0.0,1.0,0.0,0.0,0.012269004495714109,0.016797435108222514,0.016437410839586608,0.028081570388688748,0.02346873463007748
2023-06-30,$ROOT - Take Over Bid $$,S&P,0.0,1.0,0.0,0.0,0.012269004495714109,0.016797435108222514,0.016437410839586608,0.028081570388688748,0.02346873463007748
2023-06-30,"BA $17,000 GAIN✈️","BA, GAIN",0.0,0.421,0.579,0.6289,0.012269004495714109,0.016797435108222514,0.016437410839586608,0.028081570388688748,0.02346873463007748
2023-06-30,Due Diligence Report - Siri Corp ($Siri),S&P,0.0,1.0,0.0,0.0,0.012269004495714109,0.016797435108222514,0.016437410839586608,0.028081570388688748,0.02346873463007748
2023-06-30,Woke up to this…,S&P,0.0,1.0,0.0,0.0,0.012269004495714109,0.016797435108222514,0.016437410839586608,0.028081570388688748,0.02346873463007748
2023-06-30,Short AI 2nd attempt,S&P,0.0,1.0,0.0,0.0,0.012269004495714109,0.016797435108222514,0.016437410839586608,0.028081570388688748,0.02346873463007748
2023-06-30,COIN Gainz Update ~$40k. Sold remaining calls,COIN,0.0,1.0,0.0,0.0,-0.012149623770677853,0.011307463629085746,0.023751662277954555,0.15515022018268065,0.16398245698520886
2023-06-30,"Time to secure profits and sell everything or hodl tight? Yes, my losses are laughable, I have hard time letting go. Still learning. +~198k",S&P,0.131,0.575,0.294,0.6249,0.012269004495714109,0.016797435108222514,0.016437410839586608,0.028081570388688748,0.02346873463007748
2023-06-30,$CVNA 30.00 C | FD Gains | ~15K --> ~32.5K,CVNA,0.0,0.789,0.211,0.34,0.0069930189112803465,-0.07527650940646757,0.06666670329613411,0.23959829103020724,0.21064924152379083
2023-06-30,CCL earnings 10k loss then 14k gain. Market manipulation,CCL,0.324,0.432,0.245,-0.0258,0.09731935263075164,0.08906876383075879,0.18502199602649694,0.28972598847360476,0.19177213268313653
2023-06-30,Nvidia right now is moderna during covid.,S&P,0.0,1.0,0.0,0.0,0.012269004495714109,0.016797435108222514,0.016437410839586608,0.028081570388688748,0.02346873463007748
2023-06-30,YOLO BOLO $AI HYPE BEGONE,S&P,0.0,0.656,0.344,0.2732,0.012269004495714109,0.016797435108222514,0.016437410839586608,0.028081570388688748,0.02346873463007748
2023-06-30,Back in rtx yolo again bigger all movey,S&P,0.0,0.769,0.231,0.2732,0.012269004495714109,0.016797435108222514,0.016437410839586608,0.028081570388688748,0.02346873463007748
